{
  "templateVersion": "1.2.0",
  "industry": "EDTECH",
  "displayName": "EdTech",
  "description": "Online learning. Content is cheap to serve, but acquisition is expensive and demand follows the exam and admission calendar.",
  "defaults": {
    "businessModel": "SUBSCRIPTION",
    "initialCapital": 120000000,
    "initialPrice": 99900,
    "marketSize": 500000
  },
  "parameters": {
    "unitCostRate": 0.15,
    "variableCostPerCustomer": 3000,
    "logisticsCostPerOrder": 0,
    "returnRate": 0.03,
    "inventoryHoldingRate": 0.0,
    "purchasesPerCustomerPerMonth": 1,
    "fixedCostsMonthly": 3000000,
    "salaryPerEmployeeMonthly": 2000000,
    "initialEmployees": 4,
    "customersPerEmployee": 500,
    "baseChurnRate": 0.08,
    "baseCac": 180000,
    "baseConversionRate": 0.02,
    "priceElasticity": 1.3,
    "referencePrice": 99900,
    "initialProductQuality": 0.6,
    "initialBrandAwareness": 0.04,
    "marketGrowthRateMonthly": 0.012,
    "seasonality": [1.1, 1.0, 0.95, 1.15, 1.2, 1.15, 1.0, 0.95, 0.9, 0.85, 0.85, 0.9],
    "competitorIntensity": 0.7,
    "eventProbabilityMultiplier": 1.0,
    "segmentMix": {
      "priceSensitive": 0.35,
      "premium": 0.2,
      "loyal": 0.2,
      "occasional": 0.15,
      "enterprise": 0.1
    },
    "localDemandWeight": 0.3
  }
}
